<?xml version="1.0" encoding="UTF-8"?>
<!DOCTYPE conformance-test-config SYSTEM "http://www-x.antd.nist.gov:8080/p25/issi-emulator/dtd/topologyconfig.dtd">
<conformance-test-config THEARTBEAT="5000">

<!-- The Following describe the RFSSs in the system.  -->
<!-- 	maxRtpPorts="0" -->
<rfssconfig rfssName="Xrfss_1" 
	maxRtpPorts="0"
	isAdvancedRtpResourceManagementSupported="true"
        rfResourcesAvailable="false"/>

<rfssconfig rfssName="rfss_2" id="groupServingRfss" 
	maxRtpPorts="0"
	isAdvancedRtpResourceManagementSupported="true"/>

<suconfig suName="su_11" id="callingSu"/>

<!-- A definition for a group configuration. This group has one subscribers. -->
<sgconfig groupName="group_1" id="calledGroup">
<subscriber suName="su_11"/>
<subscriber suName="su_22"/>
<!-- set g-agroup -->
<groupprofile>
g-agroup:0B4561A27271
</groupprofile>
</sgconfig>

</conformance-test-config>
