<?xml version="1.0" encoding="UTF-8"?>
<!DOCTYPE conformance-test-config SYSTEM "http://www-x.antd.nist.gov:8080/p25/issi-emulator/dtd/topologyconfig.dtd">
<conformance-test-config traceOrder="rfss_2,rfss_3,Xrfss_1,rfss_4">

<rfssconfig rfssName="rfss_4" rfResourcesAvailable="false"/>
<!-- configure rfss so that the SU is not known at that RFSS -->
<rfssconfig rfssName="Xrfss_1">
<unknown-unit suName="su_14"/>
</rfssconfig>

<!-- test layout by roles -->
<suconfig suName="su_32" id="callingSu">
<userprofile unitToUnitCallPermission="ReceiveAndInitiate" isFullDuplex="false"/>
</suconfig>
<suconfig suName="su_14" id="calledSu" skipRegisterRegister="true" 
	homeRfssKnowsAboutMeFor="0" suState="on">
<userprofile unitToUnitCallPermission="ReceiveAndInitiate" isFullDuplex="false"/>
</suconfig>

</conformance-test-config>
