<?xml version="1.0" encoding="UTF-8"?>
<!DOCTYPE conformance-test-config SYSTEM "http://www-x.antd.nist.gov:8080/p25/issi-emulator/dtd/topologyconfig.dtd">
<conformance-test-config traceOrder="rfss_2,Xrfss_1,rfss_3">

<suconfig suName="su_22" id="callingSu"/>
<suconfig suName="su_33" id="calledSu"/>
<suconfig suName="su_222" id="higherPrioritySu"/>

<sgconfig groupName="group_1" id="calledGroup">
<subscriber suName="su_22"/>
<subscriber suName="su_33"/>
<subscriber suName="su_222"/>
</sgconfig>

</conformance-test-config>
