<?xml version="1.0" ?>
<!DOCTYPE conformance-test-config SYSTEM "http://www-x.antd.nist.gov:8080/p25/issi-emulator/dtd/topologyconfig.dtd">
<conformance-test-config traceOrder="Xrfss_1,rfss_2,rfss_3">

<rfssconfig rfssName="Xrfss_1" rfResourcesAvailable="false"/>
<rfssconfig rfssName="rfss_2" rfResourcesAvailable="false"/>
<suconfig suName="su_11" id="callingSu"/>

<sgconfig groupName= "group_2" id="calledGroup" protectionDisposition="reject_unprotected">
<subscriber suName="su_11"/>
<subscriber suName="su_33"/>
<!-- set g-agroup -->
<groupprofile>
g-agroup:0B4561A27271
</groupprofile>
</sgconfig>

</conformance-test-config>
