<?xml version="1.0" ?>
<!DOCTYPE conformance-test-config SYSTEM "http://www-x.antd.nist.gov:8080/p25/issi-emulator/dtd/topologyconfig.dtd">
<conformance-test-config
	traceOrder="rfss_3,rfss_2,rfss_1"
	THEARTBEAT= "2000"
>

<rfssconfig
	rfssName="Xrfss_2"
	registerConfirmTime="2"
	querySuCredentialsBeforeRegistration="true"
	queryGroupCredentialsBeforeRegistration="true"
/>
<rfssconfig
	rfssName="rfss_1"
	id="groupHome"
	isInterestedInLosingAudio="true"
	servedGroupLeaseTime = "0"
/>
<rfssconfig
	rfssName="rfss_1"
	id="groupServed"
	groupCallInviteProcessingTime="5"
	maxRtpPorts="0"
/>
<rfssconfig 
    	rfssName="rfss_2" 
    	servedGroupLeaseTime="0" 
/>
<rfssconfig
	rfssName = "rfss_2"
	id  = "servedRfss"
	rfResourcesAvailable="false"
/>
<rfssconfig
	rfssName="rfss_1"
	groupRegistrationExpiresTime="0"
/>
<rfssconfig
	rfssName="rfss_1"
	id = "homeRfss"
	maxRtpPorts="0"
	isAdvancedRtpResourceManagementSupported="true"
/>
<rfssconfig
	rfssName="rfss_1"
>
	<unknown-unit suName="su_33" />
</rfssconfig>

<suconfig	
	suName="su_12"
	id="registeringSu"
	initialState="off"
	servingRfssReferencesMeFor="0"
/>
<suconfig	
	suName="su_21"
	id="registeringSu"
	initialState="off"
	inviteProcessingDelay="7"
/>
<suconfig
	suName="su_12"
	id="registeringSu"
	checkSuPresenceOnRegister="false"
	checkCallPermission="false"
	skipRegisterRegister="false"
>
<forbidden
	rfssName="rfss_2"
/>
</suconfig>
<suconfig
	suName="su_21"
	id="registeringSu"
	checkSuPresenceOnRegister="false"
>
<forbidden
	rfssName="rfss_1"
/>
</suconfig>
<suconfig
	suName="su_22"
	id="calledSu"
	initialState="off"
/>
<suconfig
	suName="su_12"
	initialState="off"
>
<forbidden
	operation="REGISTER-QUERY"
	rfssName="rfss_2"
/>
</suconfig>
<suconfig
	suName="su_34"
	id="calledSu"
	inviteProcessingDelay="5"
	isAvailable="false"
>
<userprofile
	unitToUnitCallPermission="ReceiveAndInitiate"
	unitToUnitCallPriority="8"
	radioInhibit="RadioInhibited"
/>
</suconfig>
<suconfig
	suName="su_12"
	id="calledSu"
>
<userprofile
	unitToUnitCallPermission="Receive"
	unitToUnitCallPriority="8"
	isFullDuplex="true"
	availCheckSupported="AvailabilityCheck"
	unitToUnitCallSetupPreference="AvailabilityCheck"
/>
</suconfig>

<sgconfig
	groupName="group_1"
	id="calledGroup"
>
	<subscriber suName="su_11" />
	<subscriber suName="su_22" />
	<forbidden operation="REGISTER-QUERY" rfssName="rfss_2" />
</sgconfig>
<sgconfig
	groupName="group_2"
	id="calledGroup"
	protectionDisposition="reject_protected"
>
	<subscriber suName="su_22" />
	<subscriber suName="su_11" />
	<forbidden operation="REGISTER-QUERY" rfssName="rfss_2" />
</sgconfig>
<sgconfig
	groupName="group_1"
	id="targetGroup"
	homeRfssKnowsAboutMeFor="0"
>
	<subscriber suName="su_11" />
	<subscriber suName="su_22" />
</sgconfig>

<sgconfig 
	groupName="group_1"
	id="calledGroup"
>
	<subscriber suName="su_11" />
	<subscriber suName="su_22" />
<groupprofile>
g-access:1
g-agroup:0B4561A27271
g-pri:2
g-ecap:1
g-eprempt:0
g-rfhangt:0
g-ccsetupT:0
g-intmode:0
g-sec:1
g-ic:0
g-icsecstart:0
</groupprofile>
</sgconfig>


</conformance-test-config>
