<?xml version="1.0" ?>
<!DOCTYPE conformance-test-config SYSTEM "http://www-x.antd.nist.gov:8080/p25/issi-emulator/dtd/topologyconfig.dtd">
<conformance-test-config traceOrder="rfss_3,rfss_2,Xrfss_1">

<suconfig suName="su_33" id="callingSuA"/>
<suconfig suName="su_111" id="calledSuB"/>
<suconfig suName="su_11" id="calledSuC"/>

<sgconfig groupName="group_2" id="calledGroup">
<subscriber suName="su_33"/>
<subscriber suName="su_11"/>
<subscriber suName="su_111"/>
<!-- set g-agroup -->
<groupprofile>
g-agroup:0B4561A27271
</groupprofile>
</sgconfig>

</conformance-test-config>
