<?xml version="1.0" encoding="UTF-8"?>
<!DOCTYPE conformance-test-config SYSTEM "http://www-x.antd.nist.gov:8080/p25/issi-emulator/dtd/topologyconfig.dtd">
<conformance-test-config>

<!-- configure rfss so that the su_11 is not known at that RFSS -->
<rfssconfig rfssName="rfss_3">
<unknown-unit suName="su_11"/>
</rfssconfig>


<suconfig suName="su_11" id="callingSu"/>

<sgconfig groupName="group_3" id="calledGroup">
<subscriber suName="su_11"/>
<subscriber suName="su_33"/>
<!-- set g-agroup -->
<groupprofile>
g-agroup:0B4561A27271
</groupprofile>
</sgconfig>

</conformance-test-config>
