<?xml version="1.0" ?>
<!DOCTYPE conformance-test-config SYSTEM "http://www-x.antd.nist.gov:8080/p25/issi-emulator/dtd/topologyconfig.dtd">
<conformance-test-config traceOrder="Xrfss_1,rfss_3,rfss_2">

<suconfig suName="su_11" id="callingSuA"/>
<suconfig suName="su_222" id="calledSuB"/>
<suconfig suName="su_22" id="calledSuC"/>

<sgconfig groupName="group_3" id="calledGroup">
<subscriber suName="su_11"/>
<subscriber suName="su_22"/>
<subscriber suName="su_222"/>
</sgconfig>

</conformance-test-config>
